{
  "$schema": "https://json-schema.org/draft/2020-12/schema",
  "$id": "power/research.schema.json",
  "title": "research.json",
  "description": "Sourced findings from the research stage. Every claim carries a source_url that also appears in sources[].",
  "type": "object",
  "additionalProperties": false,
  "required": ["summary", "unknowns_resolved", "prior_art", "users", "feasibility", "sources"],
  "properties": {
    "summary": { "type": "string", "minLength": 40 },
    "unknowns_resolved": {
      "type": "array",
      "minItems": 1,
      "items": {
        "type": "object",
        "additionalProperties": false,
        "required": ["question", "answer", "resolved"],
        "properties": {
          "question": { "type": "string", "minLength": 8 },
          "answer": { "type": "string", "minLength": 8 },
          "resolved": { "type": "boolean" },
          "source_url": { "type": "string", "format": "uri" }
        }
      }
    },
    "prior_art": {
      "type": "array",
      "minItems": 1,
      "items": {
        "type": "object",
        "additionalProperties": false,
        "required": ["name", "url", "gaps"],
        "properties": {
          "name": { "type": "string", "minLength": 1 },
          "url": { "type": "string", "format": "uri" },
          "strengths": { "type": "array", "items": { "type": "string" } },
          "gaps": { "type": "array", "minItems": 1, "items": { "type": "string" } }
        }
      }
    },
    "users": {
      "type": "object",
      "additionalProperties": false,
      "required": ["pain_points"],
      "properties": {
        "pain_points": {
          "type": "array",
          "minItems": 1,
          "items": {
            "type": "object",
            "additionalProperties": false,
            "required": ["point", "severity", "source_url"],
            "properties": {
              "point": { "type": "string", "minLength": 8 },
              "severity": { "enum": ["high", "medium", "low"] },
              "evidence": { "type": "string" },
              "source_url": { "type": "string", "format": "uri" }
            }
          }
        }
      }
    },
    "feasibility": {
      "type": "object",
      "additionalProperties": false,
      "required": ["constraints"],
      "properties": {
        "constraints": {
          "type": "array",
          "items": {
            "type": "object",
            "additionalProperties": false,
            "required": ["constraint", "impact", "source_url"],
            "properties": {
              "constraint": { "type": "string", "minLength": 8 },
              "impact": { "type": "string", "minLength": 8 },
              "source_url": { "type": "string", "format": "uri" }
            }
          }
        }
      }
    },
    "open_questions": { "type": "array", "items": { "type": "string" } },
    "sources": {
      "type": "array",
      "minItems": 1,
      "items": {
        "type": "object",
        "additionalProperties": false,
        "required": ["url", "tier"],
        "properties": {
          "url": { "type": "string", "format": "uri" },
          "title": { "type": "string" },
          "tier": { "enum": ["primary", "secondary", "vendor"] },
          "accessed": { "type": "string" }
        }
      }
    }
  }
}
